{
  "capability_id": "mathematical_reasoning",
  "version": "1.0.0",
  "task_categories": ["mathematical_reasoning"],
  "description": "Solves bounded mathematical tasks.",
  "execution_modes": ["deterministic_tool", "local_model", "remote_model"],
  "allowed_tools": ["arithmetic_evaluator"],
  "allowed_validators": ["numeric_answer_validator"],
  "allowed_models": [],
  "input_schema": "schemas/task-input.schema.json",
  "output_schema": "schemas/task-result.schema.json",
  "benchmark_suites": ["math-core"],
  "deterministic_eligible": true,
  "supports_batch": true,
  "timeout_ms": 10000,
  "max_retries": 1,
  "owner_module": "amd_track1.capabilities.executors",
  "implementation": "amd_track1.capabilities.executors",
  "status": "active"
}
