{
  "capability_id": "sentiment_classification",
  "version": "1.0.0",
  "task_categories": ["sentiment_classification"],
  "description": "Classifies sentiment for short text.",
  "execution_modes": ["deterministic_tool", "local_model", "remote_model"],
  "allowed_tools": ["sentiment_validator"],
  "allowed_validators": ["sentiment_validator"],
  "allowed_models": [],
  "input_schema": "schemas/task-input.schema.json",
  "output_schema": "schemas/task-result.schema.json",
  "benchmark_suites": ["sentiment-core"],
  "deterministic_eligible": true,
  "supports_batch": true,
  "timeout_ms": 10000,
  "max_retries": 1,
  "owner_module": "amd_track1.capabilities.executors",
  "implementation": "amd_track1.capabilities.executors",
  "status": "active"
}
